Gene_set,Term,Overlap,P-value,Adjusted P-value,Old P-value,Old Adjusted P-value,Odds Ratio,Combined Score,Genes
GO_Biological_Process_2023,Positive Regulation Of Epithelial Cell Proliferation (GO:0050679),4/123,0.0003645679633982749,0.0036095011337981,0,0,13.067062118965232,103.44928559629751,PRKCA;SCN5A;EGFR;VEGFA
GO_Biological_Process_2023,Cellular Response To Ionizing Radiation (GO:0071479),3/52,0.0003953067687192971,0.0038841884774918,0,0,23.425431711146,183.55813311140764,MAPK14;SLC6A2;TP53
GO_Biological_Process_2023,Response To Nitric Oxide (GO:0071731),2/11,0.00040193981025798,0.0038904174171985,0,0,83.58909853249476,653.6005652009715,CDK2;MMP3
GO_Biological_Process_2023,Desensitization Of G Protein-Coupled Receptor Signaling Pathway (GO:0002029),2/11,0.00040193981025798,0.0038904174171985,0,0,83.58909853249476,653.6005652009715,ADRB2;DRD3
GO_Biological_Process_2023,Regulation Of Receptor Signaling Pathway Via JAK-STAT (GO:0046425),3/53,0.0004182118158827853,0.0040179312977775,0,0,22.95576923076923,178.5849236310003,IL10;IL6;CAV1
GO_Biological_Process_2023,Negative Regulation Of Intracellular Signal Transduction (GO:1902532),5/231,0.0004278765324410461,0.004080557813059,0,0,8.725221238938053,67.67871312828457,CAV1;DRD2;MAPK14;DRD3;ESR1
GO_Biological_Process_2023,Regulation Of Blood Vessel Endothelial Cell Migration (GO:0043535),3/54,0.00044195305544086894,0.0041840373204876,0,0,22.504524886877828,173.83185666097347,PRKCA;MAPK14;VEGFA
GO_Biological_Process_2023,Positive Regulation Of Peptidyl-Tyrosine Phosphorylation (GO:0050731),4/130,0.0004496975325941469,0.0042265050708304,0,0,12.33675692499222,95.07858806172706,IL6;TP53;IL2;VEGFA
GO_Biological_Process_2023,"Regulation Of Synaptic Transmission, Glutamatergic (GO:0051966)",3/55,0.0004665431530533366,0.0043221890679298,0,0,22.070636094674555,169.28531098858673,DRD1;DRD2;DRD3
GO_Biological_Process_2023,Positive Regulation Of Tyrosine Phosphorylation Of STAT Protein (GO:0042531),3/55,0.0004665431530533366,0.0043221890679298,0,0,22.070636094674555,169.28531098858673,IL6;IL2;VEGFA
GO_Biological_Process_2023,Negative Regulation Of Potassium Ion Transport (GO:0043267),2/12,0.0004814776145385075,0.0043977215919467,0,0,75.22641509433963,574.6283172633098,CAV1;NOS1
GO_Biological_Process_2023,Positive Regulation Of Sodium Ion Transport (GO:0010765),2/12,0.0004814776145385075,0.0043977215919467,0,0,75.22641509433963,574.6283172633098,NOS1;SCN5A
GO_Biological_Process_2023,Regulation Of Inflammatory Response (GO:0050727),5/240,0.0005092314840059715,0.0046186939493408,0,0,8.38723404255319,63.59710679869946,IL10;IL6;MMP3;PTGS2;IL2
GO_Biological_Process_2023,Acute-Phase Response (GO:0006953),2/13,0.0005680161453256235,0.0049778171654549,0,0,68.38421955403088,511.05993992585104,CRP;IL6
GO_Biological_Process_2023,Regulation Of Response To Stress (GO:0080134),2/13,0.0005680161453256235,0.0049778171654549,0,0,68.38421955403088,511.05993992585104,IL10;OPRM1
GO_Biological_Process_2023,Response To UV-A (GO:0070141),2/13,0.0005680161453256235,0.0049778171654549,0,0,68.38421955403088,511.05993992585104,MMP3;EGFR
GO_Biological_Process_2023,Positive Regulation Of Cyclase Activity (GO:0031281),2/13,0.0005680161453256235,0.0049778171654549,0,0,68.38421955403088,511.05993992585104,NOS1;MAPK14
GO_Biological_Process_2023,Membrane Depolarization (GO:0051899),2/13,0.0005680161453256235,0.0049778171654549,0,0,68.38421955403088,511.05993992585104,CAV1;SCN5A
GO_Biological_Process_2023,Negative Regulation Of Cell Population Proliferation (GO:0008285),6/379,0.0005895200505978639,0.0051315939974861,0,0,6.425124473381846,47.77852233916158,IL10;IL6;ADRA1D;OPRM1;DRD2;TP53
GO_Biological_Process_2023,Negative Regulation Of Cellular Process (GO:0048523),7/537,0.0006431000079036808,0.0055606714016738,0,0,5.342177672955975,39.26078724547418,IL10;IL6;ADRA1D;OPRM1;DRD2;TP53;ESR2
GO_Biological_Process_2023,Positive Regulation Of Acute Inflammatory Response (GO:0002675),2/14,0.0006615177095993661,0.0056446609825682,0,0,62.68238993710692,458.8961346318759,IL6;PTGS2
GO_Biological_Process_2023,Prostanoid Biosynthetic Process (GO:0046457),2/14,0.0006615177095993661,0.0056446609825682,0,0,62.68238993710692,458.8961346318759,PTGS2;PTGS1
GO_Biological_Process_2023,Positive Regulation Of Mitotic Cell Cycle Phase Transition (GO:1901992),3/63,0.0006953044176869378,0.0058628702713606,0,0,19.120192307692307,139.02599274334352,CDK4;EGFR;CDC25B
GO_Biological_Process_2023,Negative Regulation Of Response To External Stimulus (GO:0032102),4/146,0.0006961310885038888,0.0058628702713606,0,0,10.937862468931234,79.51796012151812,IL10;DRD1;DRD2;DRD3
GO_Biological_Process_2023,Regulation Of Tyrosine Phosphorylation Of STAT Protein (GO:0042509),3/65,0.0007618349958722256,0.0061765147245249,0,0,18.50155086848635,132.8370753770771,IL6;IL2;VEGFA
GO_Biological_Process_2023,Positive Regulation Of Cell Cycle (GO:0045787),3/65,0.0007618349958722256,0.0061765147245249,0,0,18.50155086848635,132.8370753770771,PRKCA;EGFR;CDC25B
GO_Biological_Process_2023,Regulation Of Cellular Response To Heat (GO:1900034),2/15,0.000761944761699299,0.0061765147245249,0,0,57.8577648766328,415.3977202918273,GSK3B;MTOR
GO_Biological_Process_2023,Negative Regulation Of Synaptic Transmission (GO:0050805),2/15,0.000761944761699299,0.0061765147245249,0,0,57.8577648766328,415.3977202918273,DRD2;DRD3
GO_Biological_Process_2023,Cellular Response To Estrogen Stimulus (GO:0071391),2/15,0.000761944761699299,0.0061765147245249,0,0,57.8577648766328,415.3977202918273,ESR1;ESR2
GO_Biological_Process_2023,Positive Regulation Of Potassium Ion Transport (GO:0043268),2/15,0.000761944761699299,0.0061765147245249,0,0,57.8577648766328,415.3977202918273,DRD1;ADRA2A
GO_Biological_Process_2023,Positive Regulation Of Nucleic Acid-Templated Transcription (GO:1903508),7/557,0.0007975059242514319,0.0064246284705224,0,0,5.142613636363636,36.687515192769794,IL10;IL6;NOS1;TP53;ESR1;EGFR;ESR2
GO_Biological_Process_2023,Regulation Of Protein Kinase C Signaling (GO:0090036),2/16,0.0008692599027475671,0.0068745737430706,0,0,53.722371967654986,378.6282074873072,ADRA1D;VEGFA
GO_Biological_Process_2023,Positive Regulation Of Cell Migration Involved In Sprouting Angiogenesis (GO:0090050),2/16,0.0008692599027475671,0.0068745737430706,0,0,53.722371967654986,378.6282074873072,PTGS2;VEGFA
GO_Biological_Process_2023,Negative Regulation Of Chemokine Production (GO:0032682),2/16,0.0008692599027475671,0.0068745737430706,0,0,53.722371967654986,378.6282074873072,IL10;IL6
GO_Biological_Process_2023,Response To Molecule Of Bacterial Origin (GO:0002237),3/69,0.0009067530551326726,0.0071276285606489,0,0,17.376748251748253,121.73524975527204,IL10;IL6;NOS1
GO_Biological_Process_2023,Regulation Of Transcription By RNA Polymerase II (GO:0006357),14/2028,0.0009234121643254988,0.0072148528742781,0,0,3.0401094775595223,21.242566986008843,CAV1;NR3C1;MAPK14;ESR1;ADRA2A;EGFR;ESR2;VEGFA;FOSL1;IL6;CDK4;PGR;NOS1;TP53
GO_Biological_Process_2023,Response To Lipopolysaccharide (GO:0032496),4/159,0.0009569748600791948,0.0074323137336689,0,0,10.01391524351676,69.61406942729157,IL10;IL6;NOS1;MAPK14
GO_Biological_Process_2023,Intracellular Estrogen Receptor Signaling Pathway (GO:0030520),2/17,0.0009834258801979265,0.0074734413086458,0,0,50.138364779874216,347.18151684375505,ESR1;ESR2
GO_Biological_Process_2023,Positive Regulation Of Transcription From RNA Polymerase II Promoter In Response To Stress (GO:0036003),2/17,0.0009834258801979265,0.0074734413086458,0,0,50.138364779874216,347.18151684375505,TP53;VEGFA
GO_Biological_Process_2023,Prostaglandin Biosynthetic Process (GO:0001516),2/17,0.0009834258801979265,0.0074734413086458,0,0,50.138364779874216,347.18151684375505,PTGS2;PTGS1
GO_Biological_Process_2023,Negative Regulation Of Protein Binding (GO:0032091),3/71,0.0009853187847173777,0.0074734413086458,0,0,16.863970588235293,116.74160083823348,GSK3B;CAV1;ADRB2
GO_Biological_Process_2023,Response To Ionizing Radiation (GO:0010212),3/72,0.0010261664632754,0.0077380110631874,0,0,16.618729096989966,114.36885223449828,MAPK14;SLC6A2;TP53
GO_Biological_Process_2023,Cellular Response To Reactive Oxygen Species (GO:0034614),3/73,0.0010680715944905,0.0079578558200588,0,0,16.380494505494507,112.0737136235778,IL6;SLC6A2;EGFR
GO_Biological_Process_2023,Transmembrane Receptor Protein Tyrosine Kinase Signaling Pathway (GO:0007169),5/284,0.0010855435069019,0.0079578558200588,0,0,7.048745519713262,48.11244247612311,GSK3B;ADRB2;MAPK14;EGFR;VEGFA
GO_Biological_Process_2023,Negative Regulation Of Lipid Storage (GO:0010888),2/18,0.0011044055879804,0.0079578558200588,0,0,47.00235849056604,320.01311451477966,CRP;IL6
GO_Biological_Process_2023,Negative Regulation Of Monoatomic Ion Transport (GO:0043271),2/18,0.0011044055879804,0.0079578558200588,0,0,47.00235849056604,320.01311451477966,NOS1;ADRA2A
GO_Biological_Process_2023,Cellular Response To Inorganic Substance (GO:0071241),2/18,0.0011044055879804,0.0079578558200588,0,0,47.00235849056604,320.01311451477966,MMP3;CDK2
GO_Biological_Process_2023,Positive Regulation Of CREB Transcription Factor Activity (GO:0032793),2/18,0.0011044055879804,0.0079578558200588,0,0,47.00235849056604,320.01311451477966,OPRD1;VEGFA
GO_Biological_Process_2023,Excitatory Postsynaptic Potential (GO:0060079),2/18,0.0011044055879804,0.0079578558200588,0,0,47.00235849056604,320.01311451477966,GSK3B;DRD2
GO_Biological_Process_2023,Positive Regulation Of Neuroblast Proliferation (GO:0002052),2/18,0.0011044055879804,0.0079578558200588,0,0,47.00235849056604,320.01311451477966,DRD2;VEGFA
GO_Biological_Process_2023,Phosphorylation (GO:0016310),6/429,0.0011216628411438,0.0080375508561526,0,0,5.651179620784484,38.388141132249885,GSK3B;CDK4;CDK2;PRKCA;MTOR;CDC25B
GO_Biological_Process_2023,Positive Regulation Of Neurogenesis (GO:0050769),3/75,0.001155096308952,0.0082316478720373,0,0,15.923878205128204,107.702289659327,OPRM1;DRD2;VEGFA
GO_Biological_Process_2023,Organonitrogen Compound Catabolic Process (GO:1901565),3/78,0.0012938246113639,0.0091698935570436,0,0,15.284615384615384,101.6450252290166,ACHE;BCHE;MTOR
GO_Biological_Process_2023,Cellular Response To UV (GO:0034644),3/79,0.0013422923389401,0.00941055764111,0,0,15.082742914979756,99.74785643183012,MMP3;MAPK14;TP53
GO_Biological_Process_2023,Negative Regulation Of Cellular Component Organization (GO:0051129),3/79,0.0013422923389401,0.00941055764111,0,0,15.082742914979756,99.74785643183012,OPRD1;GSK3B;VEGFA
GO_Biological_Process_2023,Cellular Response To Estradiol Stimulus (GO:0071392),2/20,0.0013666584956143,0.0095298713376977,0,0,41.77568134171908,275.5267677897696,ESR1;EGFR
GO_Biological_Process_2023,Regulation Of Cytokinesis (GO:0032465),3/80,0.0013918891757704,0.0096539051388996,0,0,14.886113886113886,97.9073604295734,DRD2;DRD3;CDC25B
GO_Biological_Process_2023,Regulation Of Interleukin-8 Production (GO:0032677),3/81,0.0014426249462319,0.0098999182818138,0,0,14.694526627218934,96.12117397495804,IL10;CRP;IL6
GO_Biological_Process_2023,Positive Regulation Of Growth (GO:0045927),3/81,0.0014426249462319,0.0098999182818138,0,0,14.694526627218934,96.12117397495804,EGFR;IL2;MTOR
GO_Biological_Process_2023,Positive Regulation Of ERK1 And ERK2 Cascade (GO:0070374),4/179,0.0014824543291079,0.0100808870974944,0,0,8.860504201680673,57.71782263346279,ADRA1D;PRKCA;OPRM1;EGFR
GO_Biological_Process_2023,Sodium Ion Transmembrane Transport (GO:0035725),3/82,0.0014945093736871,0.0100808870974944,0,0,14.507789678675756,94.3870602268694,SCN5A;SLC6A2;SLC6A4
GO_Biological_Process_2023,Regulation Of Lipid Storage (GO:0010883),2/21,0.0015078582088773,0.0100808870974944,0,0,39.57497517378352,257.1211876509781,CRP;IL6
GO_Biological_Process_2023,Regulation Of Membrane Protein Ectodomain Proteolysis (GO:0051043),2/21,0.0015078582088773,0.0100808870974944,0,0,39.57497517378352,257.1211876509781,IL10;ADRA2A
GO_Biological_Process_2023,Positive Regulation Of G2/M Transition Of Mitotic Cell Cycle (GO:0010971),2/21,0.0015078582088773,0.0100808870974944,0,0,39.57497517378352,257.1211876509781,CDK4;CDC25B
GO_Biological_Process_2023,Negative Regulation Of Protein Localization To Nucleus (GO:1900181),2/22,0.0016557246776615,0.0108551715158201,0,0,37.59433962264151,240.73597386560573,GSK3B;MTOR
GO_Biological_Process_2023,Mammary Gland Development (GO:0030879),2/22,0.0016557246776615,0.0108551715158201,0,0,37.59433962264151,240.73597386560573,CAV1;VEGFA
GO_Biological_Process_2023,Negative Regulation Of Cell Development (GO:0010721),2/22,0.0016557246776615,0.0108551715158201,0,0,37.59433962264151,240.73597386560573,GSK3B;IL6
GO_Biological_Process_2023,Positive Regulation Of Endothelial Cell Migration (GO:0010595),3/85,0.0016571503162161,0.0108551715158201,0,0,13.974906191369604,89.47651458269102,PRKCA;MAPK14;VEGFA
GO_Biological_Process_2023,Regulation Of DNA-templated Transcription (GO:0006355),13/1922,0.0017651351825694,0.0115044237778521,0,0,2.924343336077228,18.53895646312819,IL10;NR3C1;MAPK14;ESR1;ADRA2A;EGFR;ESR2;FOSL1;IL6;PGR;NOS1;TP53;RUNX1T1
GO_Biological_Process_2023,Sodium Ion Transport (GO:0006814),3/89,0.0018906584490158,0.0122609200418676,0,0,13.322227191413235,83.54142360214497,SCN5A;SLC6A2;SLC6A4
GO_Biological_Process_2023,Regulation Of Neuroblast Proliferation (GO:1902692),2/24,0.0019713124920084,0.012533295598701,0,0,34.17324185248714,212.86702757999905,DRD2;VEGFA
GO_Biological_Process_2023,Positive Regulation Of Cell Cycle G2/M Phase Transition (GO:1902751),2/24,0.0019713124920084,0.012533295598701,0,0,34.17324185248714,212.86702757999905,CDK4;CDC25B
GO_Biological_Process_2023,Positive Regulation Of Interleukin-17 Production (GO:0032740),2/24,0.0019713124920084,0.012533295598701,0,0,34.17324185248714,212.86702757999905,IL6;IL2
GO_Biological_Process_2023,Positive Regulation Of Vascular Endothelial Growth Factor Production (GO:0010575),2/24,0.0019713124920084,0.012533295598701,0,0,34.17324185248714,212.86702757999905,IL6;PTGS2
GO_Biological_Process_2023,Regulation Of Epithelial Cell Proliferation (GO:0050678),3/91,0.002014713593609,0.0127467489312731,0,0,13.018138111888112,80.80720530815613,SCN5A;EGFR;VEGFA
GO_Biological_Process_2023,Regulation Of Platelet Aggregation (GO:0090330),2/25,0.0021389615004277,0.0133673956487419,0,0,32.68580803937654,200.93387537332225,IL6;PRKCA
GO_Biological_Process_2023,Regulation Of B Cell Activation (GO:0050864),2/25,0.0021389615004277,0.0133673956487419,0,0,32.68580803937654,200.93387537332225,IL10;IL6
GO_Biological_Process_2023,Regulation Of Endothelial Cell Proliferation (GO:0001936),3/93,0.0021437303738923,0.0133673956487419,0,0,12.727564102564102,78.21352622515597,CAV1;PRKCA;VEGFA
GO_Biological_Process_2023,Anterograde Trans-Synaptic Signaling (GO:0098916),4/199,0.0021821360553596,0.0135417725540739,0,0,7.943690296631473,48.67457336957043,CHRNA2;HTR3A;SLC6A2;DRD4
GO_Biological_Process_2023,Positive Regulation Of Epithelial Cell Migration (GO:0010634),3/95,0.0022777775657817,0.0138895044796194,0,0,12.449623745819398,75.75042119812595,PRKCA;MTOR;VEGFA
GO_Biological_Process_2023,Acute Inflammatory Response (GO:0002526),2/26,0.0023131325887415,0.0138895044796194,0,0,31.32232704402516,190.09998180598296,CRP;IL6
GO_Biological_Process_2023,Regulation Of Vascular Endothelial Growth Factor Production (GO:0010574),2/26,0.0023131325887415,0.0138895044796194,0,0,31.32232704402516,190.09998180598296,IL6;PTGS2
GO_Biological_Process_2023,Regulation Of Vasoconstriction (GO:0019229),2/26,0.0023131325887415,0.0138895044796194,0,0,31.32232704402516,190.09998180598296,CAV1;ADRA1D
GO_Biological_Process_2023,Mitotic G1 DNA Damage Checkpoint Signaling (GO:0031571),2/26,0.0023131325887415,0.0138895044796194,0,0,31.32232704402516,190.09998180598296,CDK2;TP53
GO_Biological_Process_2023,Negative Regulation Of Catalytic Activity (GO:0043086),2/26,0.0023131325887415,0.0138895044796194,0,0,31.32232704402516,190.09998180598296,NOS1;TP53
GO_Biological_Process_2023,Regulation Of Cardiac Muscle Cell Contraction (GO:0086004),2/26,0.0023131325887415,0.0138895044796194,0,0,31.32232704402516,190.09998180598296,CAV1;SCN5A
GO_Biological_Process_2023,Cellular Response To Acid Chemical (GO:0071229),2/27,0.0024937899442036,0.0148369062276704,0,0,30.067924528301887,180.22568613100944,MTOR;VEGFA
GO_Biological_Process_2023,Positive Regulation Of Mitotic Cell Cycle (GO:0045931),2/27,0.0024937899442036,0.0148369062276704,0,0,30.067924528301887,180.22568613100944,PRKCA;CDC25B
GO_Biological_Process_2023,Regulation Of Sodium Ion Transmembrane Transport (GO:1902305),2/28,0.0026808978945138,0.0157335953356765,0,0,28.9100145137881,171.19364328325966,NOS1;SCN5A
GO_Biological_Process_2023,Vascular Endothelial Growth Factor Receptor Signaling Pathway (GO:0048010),2/28,0.0026808978945138,0.0157335953356765,0,0,28.9100145137881,171.19364328325966,MAPK14;VEGFA
GO_Biological_Process_2023,Regulation Of Bone Resorption (GO:0045124),2/28,0.0026808978945138,0.0157335953356765,0,0,28.9100145137881,171.19364328325966,IL6;PRKCA
GO_Biological_Process_2023,Calcium Ion Homeostasis (GO:0055074),3/102,0.0027875150003159,0.01628561691626,0,0,11.565268065268064,68.03390098219067,CAV1;DRD3;DRD4
GO_Biological_Process_2023,Response To Steroid Hormone (GO:0048545),2/29,0.0028744209090306,0.0166434103527354,0,0,27.83787561146052,162.90457697750804,CAV1;NR3C1
GO_Biological_Process_2023,Positive Regulation Of Neural Precursor Cell Proliferation (GO:2000179),2/29,0.0028744209090306,0.0166434103527354,0,0,27.83787561146052,162.90457697750804,DRD2;VEGFA
GO_Biological_Process_2023,Prostaglandin Metabolic Process (GO:0006693),2/30,0.0030743235966317,0.017643352676245,0,0,26.842318059299192,155.2739619530397,PTGS2;PTGS1
GO_Biological_Process_2023,Regulation Of Cell Migration Involved In Sprouting Angiogenesis (GO:0090049),2/30,0.0030743235966317,0.017643352676245,0,0,26.842318059299192,155.2739619530397,PTGS2;VEGFA
GO_Biological_Process_2023,Positive Regulation Of Cell Growth (GO:0030307),3/106,0.0031078873837272,0.0177574006021771,0,0,11.113890963405526,64.16951791648675,EGFR;IL2;MTOR
GO_Biological_Process_2023,Regulation Of Cellular Response To Stress (GO:0080135),3/107,0.0031913629139537,0.0181543758745526,0,0,11.006471893491124,63.25757524453757,GSK3B;OPRM1;MTOR
GO_Biological_Process_2023,Response To Estradiol (GO:0032355),2/31,0.0032805707069433,0.0184995661169802,0,0,25.915419648666237,148.2294073291968,ESR1;EGFR
GO_Biological_Process_2023,Positive Regulation Of Leukocyte Migration (GO:0002687),2/31,0.0032805707069433,0.0184995661169802,0,0,25.915419648666237,148.2294073291968,IL6;VEGFA
GO_Biological_Process_2023,Negative Regulation Of Fat Cell Differentiation (GO:0045599),2/32,0.0034931271287104,0.0196129259131492,0,0,25.050314465408807,141.7085747770232,IL6;RUNX1T1
GO_Biological_Process_2023,Mitotic Cell Cycle Phase Transition (GO:0044772),3/111,0.0035390131021105,0.0197849137648165,0,0,10.596688034188034,59.8067257511645,CDK4;CDK2;CDC25B
GO_Biological_Process_2023,Small GTPase Mediated Signal Transduction (GO:0007264),3/112,0.003629397969687,0.020203129470747,0,0,10.49894142554693,58.99028137672536,CDK2;TP53;ADRA2A
GO_Biological_Process_2023,Vasculogenesis (GO:0001570),2/33,0.0037119578894409,0.0204969610400809,0,0,24.241022519780888,135.65750862045326,CAV1;VEGFA
GO_Biological_Process_2023,Positive Regulation Of Cellular Component Organization (GO:0051130),3/113,0.0037211855876421,0.0204969610400809,0,0,10.402972027972028,58.19123940459462,GSK3B;MMP3;VEGFA
GO_Biological_Process_2023,Negative Regulation Of Multicellular Organismal Process (GO:0051241),4/231,0.0037295935277248,0.0204969610400809,0,0,6.812818519478276,38.09357515840988,IL10;GSK3B;EGFR;SLC6A4
GO_Biological_Process_2023,Positive Regulation Of Transcription By RNA Polymerase II (GO:0045944),8/938,0.0039063357301401,0.0211005186683083,0,0,3.4802104781514527,19.2983082664384,IL6;PGR;NOS1;NR3C1;TP53;ESR1;EGFR;VEGFA
GO_Biological_Process_2023,Regulation Of Interleukin-17 Production (GO:0032660),2/34,0.0039370281555363,0.0211005186683083,0,0,23.48231132075472,130.0292861762509,IL6;IL2
GO_Biological_Process_2023,Regulation Of Metal Ion Transport (GO:0010959),2/34,0.0039370281555363,0.0211005186683083,0,0,23.48231132075472,130.0292861762509,NOS1;DRD2
GO_Biological_Process_2023,Cellular Response To Amyloid-Beta (GO:1904646),2/34,0.0039370281555363,0.0211005186683083,0,0,23.48231132075472,130.0292861762509,GSK3B;ADRB2
GO_Biological_Process_2023,Cellular Response To Hydrogen Peroxide (GO:0070301),2/34,0.0039370281555363,0.0211005186683083,0,0,23.48231132075472,130.0292861762509,IL6;SLC6A2
GO_Biological_Process_2023,Cellular Response To Vascular Endothelial Growth Factor Stimulus (GO:0035924),2/34,0.0039370281555363,0.0211005186683083,0,0,23.48231132075472,130.0292861762509,MAPK14;VEGFA
GO_Biological_Process_2023,Cellular Response To Molecule Of Bacterial Origin (GO:0071219),3/117,0.0041024975491457,0.0218968696347407,0,0,10.035931174089068,55.15907678184662,IL10;IL6;MAPK14
GO_Biological_Process_2023,Regulation Of Cardiac Muscle Contraction (GO:0055117),2/35,0.0041683032309063,0.0221569233216618,0,0,22.769582618639223,124.78291919154653,NOS1;SCN5A
GO_Biological_Process_2023,Positive Regulation Of Cell Cycle Process (GO:0090068),3/118,0.0042013986787755,0.0222416901484567,0,0,9.948160535117056,54.439694841039895,DRD2;DRD3;CDC25B
GO_Biological_Process_2023,Negative Regulation Of Protein Kinase B Signaling (GO:0051898),2/36,0.0044057485573151,0.023134639185578,0,0,22.098779134295228,119.88245371315708,DRD2;DRD3
GO_Biological_Process_2023,Blood Vessel Diameter Maintenance (GO:0097746),2/36,0.0044057485573151,0.023134639185578,0,0,22.098779134295228,119.88245371315708,CRP;NOS1
GO_Biological_Process_2023,Regulation Of ERK1 And ERK2 Cascade (GO:0070372),4/244,0.0045287953881081,0.0236848694289366,0,0,6.439542483660131,34.75613809810014,ADRA1D;PRKCA;OPRM1;EGFR
GO_Biological_Process_2023,Negative Regulation Of Transferase Activity (GO:0051348),2/37,0.0046493297130716,0.0238347060784739,0,0,21.466307277628037,115.29622797888813,GSK3B;TP53
GO_Biological_Process_2023,Regulation Of Phosphoprotein Phosphatase Activity (GO:0043666),2/37,0.0046493297130716,0.0238347060784739,0,0,21.466307277628037,115.29622797888813,GSK3B;MTOR
GO_Biological_Process_2023,Positive Regulation Of Immune Effector Process (GO:0002699),2/37,0.0046493297130716,0.0238347060784739,0,0,21.466307277628037,115.29622797888813,IL10;IL2
GO_Biological_Process_2023,Positive Regulation Of Receptor Signaling Pathway Via JAK-STAT (GO:0046427),2/37,0.0046493297130716,0.0238347060784739,0,0,21.466307277628037,115.29622797888813,IL10;IL6
GO_Biological_Process_2023,Positive Regulation Of Receptor Signaling Pathway Via STAT (GO:1904894),2/37,0.0046493297130716,0.0238347060784739,0,0,21.466307277628037,115.29622797888813,IL10;IL6
GO_Biological_Process_2023,Cellular Response To Lipopolysaccharide (GO:0071222),3/124,0.0048253054284841,0.0246394533100156,0,0,9.452002542911634,50.41585909089752,IL10;IL6;MAPK14
GO_Biological_Process_2023,G2/M Transition Of Mitotic Cell Cycle (GO:0000086),2/38,0.0048990124149553,0.0249177219694002,0,0,20.86897274633124,110.99625699529578,CDK2;CDC25B
GO_Biological_Process_2023,Regulation Of Mitotic Cell Cycle (GO:0007346),3/125,0.0049344298084278,0.0249998260216049,0,0,9.37405422446406,49.79045918148615,IL10;PRKCA;CDC25B
GO_Biological_Process_2023,Regulation Of Nitric Oxide Biosynthetic Process (GO:0045428),2/39,0.005154762512853,0.0259136704619005,0,0,20.30392656807751,106.95771941641132,CAV1;PTGS2
GO_Biological_Process_2023,Positive Regulation Of Intrinsic Apoptotic Signaling Pathway (GO:2001244),2/39,0.005154762512853,0.0259136704619005,0,0,20.30392656807751,106.95771941641132,CAV1;TP53
GO_Biological_Process_2023,Negative Regulation Of Protein Localization (GO:1903828),2/40,0.0054165459946757,0.0267120157988382,0,0,19.768619662363456,103.15852743339592,GSK3B;MTOR
GO_Biological_Process_2023,Cell Cycle G2/M Phase Transition (GO:0044839),2/40,0.0054165459946757,0.0267120157988382,0,0,19.768619662363456,103.15852743339592,CDK2;CDC25B
GO_Biological_Process_2023,Positive Regulation Of Catalytic Activity (GO:0043085),2/40,0.0054165459946757,0.0267120157988382,0,0,19.768619662363456,103.15852743339592,CAV1;MAPK14
GO_Biological_Process_2023,Positive Regulation Of Wound Healing (GO:0090303),2/40,0.0054165459946757,0.0267120157988382,0,0,19.768619662363456,103.15852743339592,ADRA2A;MTOR
GO_Biological_Process_2023,Negative Regulation Of Cell-Cell Adhesion (GO:0022408),2/40,0.0054165459946757,0.0267120157988382,0,0,19.768619662363456,103.15852743339592,IL10;VEGFA
GO_Biological_Process_2023,Regulation Of Heart Rate By Cardiac Conduction (GO:0086091),2/41,0.0056843289829896,0.0279264192838542,0,0,19.260764392839864,99.5789645542479,CAV1;SCN5A
GO_Biological_Process_2023,Positive Regulation Of Calcium Ion Transmembrane Transport (GO:1904427),2/42,0.0059580777350701,0.0291608559335321,0,0,18.77830188679245,96.20137910485468,CAV1;DRD1
GO_Biological_Process_2023,Positive Regulation Of Signal Transduction (GO:0009967),4/266,0.0061315917301209,0.0298972724585218,0,0,5.892231701841042,30.016801264079277,IL6;PRKCA;DRD3;VEGFA
GO_Biological_Process_2023,Regulation Of Protein Kinase B Signaling (GO:0051896),3/136,0.0062339750271186,0.0300757359109275,0,0,8.593984962406015,43.638030686995705,DRD2;DRD3;EGFR
GO_Biological_Process_2023,Positive Regulation Of Cell-Matrix Adhesion (GO:0001954),2/43,0.0062377586430528,0.0300757359109275,0,0,18.3193741371376,93.00992375609684,GSK3B;VEGFA
GO_Biological_Process_2023,Learning (GO:0007612),2/43,0.0062377586430528,0.0300757359109275,0,0,18.3193741371376,93.00992375609684,DRD2;DRD3
GO_Biological_Process_2023,Cellular Response To Ketone (GO:1901655),2/44,0.0065233382304956,0.0311057709005621,0,0,17.88230008984726,89.9903332561638,ADCY2;NR3C1
GO_Biological_Process_2023,Positive Regulation Of Chemotaxis (GO:0050921),2/44,0.0065233382304956,0.0311057709005621,0,0,17.88230008984726,89.9903332561638,IL6;VEGFA
